239634,artworks,https://api.artic.edu/api/v1/artworks/239634,False,Walnut Tree Orchard: Set 9,,"{'lqip': 'data:image/gif;base64,R0lGODlhCAAFAPUAAHp3d4KGkKSdlq+rqca/ucLAvsrCuMzEvMzGv7/AwsvGwcnHx8zIxc3Ixc7JxMjHyM7Lyc7Myc/OzNbPx9DNydHOytHPy9XSztLS0dbV0dHT1tPV1tnX09rX09rZ1dra19XX2Nfa2tnb3Njb3drd3tve3uPh3ubk3wAAAAAAAAAAAAAAAAAAAAAAAAAAAAAAAAAAAAAAAAAAAAAAAAAAAAAAAAAAAAAAAAAAAAAAAAAAAAAAAAAAAAAAAAAAAAAAACH5BAAAAAAALAAAAAAIAAUAAAYlwFGJJAqBNhpMgnGpOCKQR2DQoSAWjQJAMDkYCIrPyeThZCySIAA7', 'width': 5699, 'height': 3799, 'alt_text': 'A work made of silver gelatin print, pen and black ink on white wove strathmore paper.'}",2017.280a-c,True,,1975.0,2014.0,1975–2014,Made,4.0,"Charles Gaines
American, born 1944",,"<p>For over 40 years, Charles Gaines has created rigorous, rule-based photographs, drawings, and prints to reveal systems of order and meaning. As a leading exponent of Conceptual Art in the 1970s, he created serialized representative images based on exacting, self-imposed constraints. His works use dense grids of hand-drawn lines, numbers, and colors to demonstrate methodical ways of realizing forms such as trees and the human body. His arbitrary yet exhaustive processes provide alternative ways of representing universally known images, thereby investigating their visual content and potential  meaning.<p>
<p>For <em>Walnut Tree Orchard</em>, Gaines photographed 26 barren trees in a documentary fashion then devised systems to map each organic shape on a hand-drawn grid on paper. In the first drawing, the unique form is painstakingly drawn as an outline and thus generalized into an iconic “tree” in flattened space. For the third and final representation, the tree is sequentially plotted with others that have come before it in the series—in this case, the ninth with the first eight. With quiet restraint, visual precision, exacting marks, and mathematical sequencing, Gaines depicts this seemingly familiar natural form with unexpected curiosity, neutrality, and richness.<p>
",,Sheet: 73.3 × 58.3 cm (28 7/8 × 23 in.),"[{'depth': None, 'width': 58, 'height': 73, 'diameter': None, 'clarification': 'Sheet'}]","Silver gelatin print, pen and black ink on white wove Strathmore paper",,Gift of Society for Contemporary Art,,"Christopher Knight, ""Review. Hammer’s ‘Gridwork’ plots Charles Gaines’ captivating process,"" Los Angeles Times, March 3, 2015, Online, https://www.latimes.com/entertainment/arts/la-et-cm-knight-hammer-charles-gaines-review-20150303-column.html

Travis Diehl, ""A/The//Grid/Work,"" X-TRA 17, no. 4 (Summer 2015): Online, https://www.x-traonline.org/article/gridwork/

Kari Rittenbach, Trees in the Forest, exh. pamphlet (Portland: Yale Union, 2016), n.p., cat. 31. 

Matthew S. Witkovsky et al., The Art Institute of Chicago Field Guide to Photography and Media, (Chicago: Art Institute of Chicago, 2023), 361, pl. 353 (color ill.).","Los Angeles, The Hammer Museum, Charles Gaines: Gridwork, 1974–1989, Feb. 7–May 24, 2015, no cat.
 
Portland, Yale Union, Trees in the Forest, July 23–Sept. 4, 2016, cat. 31.
 
The Art Institute of Chicago, Society for Contemporary Art Annual Exhibition 2017, May 26–Oct. 31, 2017, no cat.","The artist; sold through Paula Cooper Gallery, New York, to the Society for Contemporary Art at the Art Institute of Chicago, June 5, 2017 [purchase agreement; copy in curatorial object file]; given to the Art Institute of Chicago, Oct. 3, 2017.",,Web Cataloged,246,2018,,False,False,843,,False,False,False,13.4061,"{'h': 224, 'l': 47, 's': 5, 'percentage': 0.005910090635461388, 'population': 28}",,,,False,,,,,Drawing and Watercolor,14,Contemporary Art,PC-8,9153.0,Charles Gaines,[],[9153],['Charles Gaines'],"['PC-142', 'PC-8']","['African American artists', 'Contemporary Art']","['paper (fiber product)', '21st Century']",TM-12913,21st Century,[],['TM-12913'],['21st Century'],,,[],[],[],,[],[],[],TM-2982,[],['TM-2982'],['paper (fiber product)'],,[],[],[],['African American artists'],447822cb-2fb5-f598-ecb3-9219c377e9f6,[],[],[],[],[],[],[],[],"[{'input': ['2017.280a-c'], 'contexts': {'groupings': ['accession']}}, {'input': ['Walnut Tree Orchard: Set 9'], 'weight': 24, 'contexts': {'groupings': ['title']}}]",2026-05-01T11:12:36-05:00,2026-05-17T06:35:57-05:00,2026-05-17T06:36:31-05:00,
180605,artworks,https://api.artic.edu/api/v1/artworks/180605,False,"Joan Miró on His House Roof, Montroig, Spain",,"{'lqip': 'data:image/gif;base64,R0lGODlhBAAFAPQAAFFQTlhXVWBfXWdmY2dnY2hnZGtqZ29ua3BvbHV0cISDf5mZlJualZ2cl56emJ+emKKinMjJwAAAAAAAAAAAAAAAAAAAAAAAAAAAAAAAAAAAAAAAAAAAAAAAAAAAAAAAACH5BAAAAAAALAAAAAAEAAUAAAURINQsTHEgiTMQQhQAxlMYSggAOw==', 'width': 2566, 'height': 3259, 'alt_text': 'A work made of gelatin silver print.'}",2003.34,False,,1948.0,1948.0,"1948, printed July 2002",Made,4.0,"Irving Penn
American, 1917–2009",United States,,,Image/paper: 34.1 × 26.7 cm (13 7/16 × 10 9/16 in.); Mount: 39.2 × 31.5 cm (15 7/16 × 12 7/16 in.),"[{'depth': None, 'width': 26, 'height': 34, 'diameter': None, 'clarification': 'Image/paper'}, {'depth': None, 'width': 31, 'height': 39, 'diameter': None, 'clarification': 'Mount'}]",Gelatin silver print,,Gift of Irving Penn,,,,"Given by the artist to the Art Institute, 2003.",of 6,Web Cataloged,20,2003,,False,True,1280,Copyright The Irving Penn Foundation,False,False,False,4.737,"{'h': 52, 'l': 52, 's': 2, 'percentage': 0.12443993797755472, 'population': 1134}",,,,False,,,,,Photograph,2,Photography and Media,PC-12,36169.0,Irving Penn,[],[36169],['Irving Penn'],"['PC-479', 'PC-487', 'PC-469', 'PC-12']","['Gelatin silver prints', 'Permanent collection holdings', 'Irving Penn', 'Photography and Media']","['gelatin silver (developing-out-paper) pr', 'photographic paper', '21st Century', 'black-and-white photography', 'photograph', 'photography', 'photographic processes', 'photographic techniques', 'photography']",TM-12913,21st Century,[],['TM-12913'],['21st Century'],TM-213,gelatin silver (developing-out-paper) pr,"['TM-240', 'TM-67']","['TM-213', 'TM-240', 'TM-67']","['gelatin silver (developing-out-paper) pr', 'photograph', 'photography']",,[],[],[],TM-3046,[],['TM-3046'],['photographic paper'],TM-12089,"['TM-3937', 'TM-3977', 'TM-3978']","['TM-12089', 'TM-3937', 'TM-3977', 'TM-3978']","['black-and-white photography', 'photographic processes', 'photographic techniques', 'photography']",[],eea804a1-9a45-2c19-edc2-2c61e45b17db,[],[],[],[],[],[],[],[],"[{'input': ['2003.34'], 'contexts': {'groupings': ['accession']}}, {'input': ['Joan Miró on His House Roof, Montroig, Spain'], 'weight': 964, 'contexts': {'groupings': ['title']}}]",2022-11-28T16:12:22-06:00,2026-05-17T06:35:57-05:00,2026-05-17T06:36:31-05:00,
27966,artworks,https://api.artic.edu/api/v1/artworks/27966,False,Head of a Soldier,,"{'lqip': 'data:image/gif;base64,R0lGODlhBQAFAPQAAHRURXJVSXhTSX1pXIZmUodhVIpmWpdxYZ2EVKiMX5+AaaKBa62PfqaUfcauaMOqbta+aa2Xhq+TibOUhb+qlsSvlc67l8W0otHCrwAAAAAAAAAAAAAAAAAAAAAAAAAAACH5BAAAAAAAIf8LSW1hZ2VNYWdpY2sOZ2FtbWE9MC40NTQ1NDUALAAAAAAFAAUAAAUVYBUNwkQVi8FcyiFhTQA8FkIkkBMCADs=', 'width': 10559, 'height': 11340, 'alt_text': 'A work made of oil on canvas.'}",1926.213,False,,1917.0,1917.0,1917,,,"Ferdinand Hodler
Swiss, 1853-1918",Switzerland,,,47 × 45.8 cm (18 1/2 × 18 in.),"[{'depth': None, 'width': 45, 'height': 47, 'diameter': None, 'clarification': None}]",Oil on canvas,Signed: E. Hodler in lower r. cor.,Helen Birch Bartlett Memorial Collection,,"Reinhold Heller, “Ferdinand Hodler:  a Unique Note in the Birch Bartlett Collection,” Art Institute of Chicago Museum Studies 12, no. 2 (1986), pp. 167-187 (ill.).","""A Century of Progress"", 1934, no. 318","Willy Russ-Young (1877–1959), Serrières-Neuchâtel, Switzerland [record held in curatorial object file]. Sold through Galerie Fischer, Lucerne, Switzerland, to Frederic Clay Bartlett (1873–1953), Chicago, July 1924 [invoice from Galerie Fischer to Frederic Clay Bartlett, July 16, 1924, copy in curatorial file]; given to the Art Institute of Chicago, 1926.",,Web Cataloged,246,1926,,False,False,843,,False,False,False,0.0,"{'h': 47, 'l': 61, 's': 52, 'percentage': 0.0010556287981549211, 'population': 1264}",,,,False,,,,,Painting,1,,,34961.0,Ferdinand Hodler,[],[34961],['Ferdinand Hodler'],[],[],"['painting', 'Century of Progress', 'modern and contemporary art', ""world's fairs"", ""Chicago World's Fairs"", 'brown (color)', 'red (color)', 'yellow (color)', 'hats', 'beards', 'soldiers', 'men']",,,[],[],[],TM-9,painting,['TM-155'],"['TM-9', 'TM-155']","['painting', 'modern and contemporary art']",TM-12169,"['TM-11299', 'TM-12176', 'TM-11844', 'TM-11851', 'TM-11842', 'TM-12109', 'TM-12347', 'TM-8811', 'TM-10121']","['TM-12169', 'TM-11299', 'TM-12176', 'TM-11844', 'TM-11851', 'TM-11842', 'TM-12109', 'TM-12347', 'TM-8811', 'TM-10121']","['Century of Progress', ""world's fairs"", ""Chicago World's Fairs"", 'brown (color)', 'red (color)', 'yellow (color)', 'hats', 'beards', 'soldiers', 'men']",,[],[],[],,[],[],[],[],1ef895a7-c724-2944-09f5-ac849841db94,[],[],[],[],[],[],[],[],"[{'input': ['1926.213'], 'contexts': {'groupings': ['accession']}}, {'input': ['Head of a Soldier'], 'weight': 958, 'contexts': {'groupings': ['title']}}]",2026-05-01T10:58:14-05:00,2026-05-17T06:35:57-05:00,2026-05-17T06:36:31-05:00,
286372,artworks,https://api.artic.edu/api/v1/artworks/286372,False,Diptych of Meghdoot: The Cloud Messenger,,"{'lqip': 'data:image/gif;base64,R0lGODlhBAAFAPQAABUUFhcWGCIgICMhJDMxLzQxMTE2MDs5OVVRSlZZS2RhWW9kXmNrWm9oYJCLiJuWkLizpcLDreDRx+fd1AAAAAAAAAAAAAAAAAAAAAAAAAAAAAAAAAAAAAAAAAAAAAAAACH5BAAAAAAALAAAAAAEAAUAAAURIKEwBgJFSTNJi+A8RQAcQwgAOw==', 'width': 1622, 'height': 2250, 'alt_text': 'A work made of gouache and gold leaf on handmade paper.'}",2015.453a-b,True,,,,2011,,,"Yugal Kishor Sharma
Indian, b. 1959",India,,,28 × 38 cm (11 × 14 15/16 in.),"[{'depth': None, 'width': 38, 'height': 28, 'diameter': None, 'clarification': None}]",Gouache and gold leaf on handmade paper,,"Indian, Southeast Asian, Himalayan, and Islamic Art Acquisition Fund",,,,,,Web Basic,8,2016,,False,True,1280,© 2011 Yugal Kishor Sharma.,False,False,False,16.4707,"{'h': 41, 'l': 43, 's': 41, 'percentage': 0.002739817771675764, 'population': 27}",,,,False,,,,,Painting,1,Arts of Asia,PC-7,114567.0,Yugal Kishor Sharma,[],[114567],['Yugal Kishor Sharma'],['PC-7'],['Arts of Asia'],"['paper (fiber product)', 'painting']",,,[],[],[],,,['TM-9'],['TM-9'],['painting'],,[],[],[],TM-2982,[],['TM-2982'],['paper (fiber product)'],,[],[],[],[],a405338f-97eb-b04a-d096-5de8f5cf2204,['787b6232-6462-17f8-6bd7-ba41d0152d35'],[],[],[],[],[],[],[],"[{'input': ['2015.453a-b'], 'contexts': {'groupings': ['accession']}}, {'input': ['Diptych of Meghdoot: The Cloud Messenger'], 'weight': 1, 'contexts': {'groupings': ['title']}}]",2026-05-11T11:01:35-05:00,2026-05-17T06:35:56-05:00,2026-05-17T06:36:31-05:00,
